{
  "schema_version": "2.0",
  "tenant_id": "00000000-0000-0000-0000-000000000001",
  "site_id": "00000000-0000-0000-0000-000000000002",
  "device_id": "00000000-0000-0000-0000-000000000003",
  "plan_id": "7c9e6679-7425-40de-944b-e07fc1f90ae7",
  "generated_at": "2026-07-18T10:00:04Z",
  "horizon_slots": 2,
  "slot_minutes": 15,
  "grid_import_limit_kw": 42.5,
  "entities": [
    {
      "entity_id": "batt-main",
      "kind": "storage",
      "reserve_soc_pct": 25,
      "slots": [
        { "start": "2026-07-18T10:00:00Z", "commands": { "setpoint_kw": 12.0 } },
        { "start": "2026-07-18T10:15:00Z", "commands": { "setpoint_kw": -8.5 } }
      ]
    },
    {
      "entity_id": "pv-roof-east",
      "kind": "pv-generation",
      "slots": [
        { "start": "2026-07-18T10:00:00Z", "commands": { "limit_kw": 40.0 } },
        { "start": "2026-07-18T10:15:00Z", "commands": { "limit_pct": 100 } }
      ]
    }
  ]
}
